{
  "schema_version": "answer-summary-final-decisions.v1",
  "session": "令和8年第4回定例会",
  "diet_session_slug": "ishigaki-r8-dai4-teireikai",
  "artifact_type": "answer_summary_final_decisions",
  "artifact_origin": "hand_authored_reviewer_decision",
  "review_status": "reviewer_only",
  "source_answer_summary_candidates": "../answer-summary-candidates/r8-dai4-teireikai.answer-summary-candidates.json",
  "source_utterance_index": "../utterance-index/r8-dai4-teireikai.utterances.json",
  "source_general_questions": "../../general_questions/r8-dai4-teireikai.general-questions.json",
  "reviewed_from_commit": "3d00b69935489707dda36e53112d1e24502a242e",
  "summary": {
    "reviewed_total": 10,
    "approve_as_written_total": 2,
    "approve_with_revision_total": 1,
    "hold_attribution_total": 7,
    "reject_total": 0,
    "final_summary_non_null_total": 3,
    "final_summary_null_total": 7,
    "approved_for_public_json_total": 0,
    "not_approved_total": 10
  },
  "decisions": [
    {
      "decision_id": "r8-dai4-teireikai::ishigaki-r8-dai4-ippan-tomoyose-eizo.item07::ishigaki-r8-dai4-teireikai.gq.ishigaki-r8-dai4-ippan-tomoyose-eizo.u0019::unknown_answer_like::answer-summary-decision-v1",
      "candidate_id": "ishigaki-r8-dai4-ippan-tomoyose-eizo.item07::ishigaki-r8-dai4-teireikai.gq.ishigaki-r8-dai4-ippan-tomoyose-eizo.u0019::unknown_answer_like",
      "question_id": "ishigaki-r8-dai4-ippan-tomoyose-eizo",
      "item_number": 7,
      "source_utterance_id": "ishigaki-r8-dai4-teireikai.gq.ishigaki-r8-dai4-ippan-tomoyose-eizo.u0019",
      "decision": "hold_attribution",
      "final_summary": null,
      "revision_reason": null,
      "attribution_confidence": "medium",
      "item_match_confidence": "high",
      "speaker_name": "総務省田原治",
      "speaker_role": "unknown",
      "evidence_excerpt": "コンサル業務の推移についてお答えいたします。本市におきましては、施設の維持管理建設事業に関連する設計管理など多岐にわたる業務に対して委託を行っております。",
      "confirmed_facts_overlap": "none",
      "final_approval_status": "not_approved",
      "review_notes": "市側答弁ブロックとしては妥当だが、speaker表記が文字起こし上崩れており、正確な役職名を確定できないためsummary化を保留する。"
    },
    {
      "decision_id": "r8-dai4-teireikai::ishigaki-r8-dai4-ippan-shiuezato-atsushi.item01::ishigaki-r8-dai4-teireikai.gq.ishigaki-r8-dai4-ippan-shiuezato-atsushi.u0006::unknown_answer_like::answer-summary-decision-v1",
      "candidate_id": "ishigaki-r8-dai4-ippan-shiuezato-atsushi.item01::ishigaki-r8-dai4-teireikai.gq.ishigaki-r8-dai4-ippan-shiuezato-atsushi.u0006::unknown_answer_like",
      "question_id": "ishigaki-r8-dai4-ippan-shiuezato-atsushi",
      "item_number": 1,
      "source_utterance_id": "ishigaki-r8-dai4-teireikai.gq.ishigaki-r8-dai4-ippan-shiuezato-atsushi.u0006",
      "decision": "hold_attribution",
      "final_summary": null,
      "revision_reason": null,
      "attribution_confidence": "medium",
      "item_match_confidence": "high",
      "speaker_name": "総務省田原総務",
      "speaker_role": "unknown",
      "evidence_excerpt": "市職員の窓口での対応についてお答えいたします。職員の窓口対応につきましては、これまでも研修等を実施するなどして接遇マナーの向上に努めているところです。",
      "confirmed_facts_overlap": "none",
      "final_approval_status": "not_approved",
      "review_notes": "市側答弁としての位置付けは強いが、speaker表記が文字起こし上崩れており、正確な役職・氏名を確定できないためsummary化を保留する。"
    },
    {
      "decision_id": "r8-dai4-teireikai::ishigaki-r8-dai4-ippan-shiuezato-atsushi.item04::ishigaki-r8-dai4-teireikai.gq.ishigaki-r8-dai4-ippan-shiuezato-atsushi.u0010::null_item_proximity::answer-summary-decision-v1",
      "candidate_id": "ishigaki-r8-dai4-ippan-shiuezato-atsushi.item04::ishigaki-r8-dai4-teireikai.gq.ishigaki-r8-dai4-ippan-shiuezato-atsushi.u0010::null_item_proximity",
      "question_id": "ishigaki-r8-dai4-ippan-shiuezato-atsushi",
      "item_number": 4,
      "source_utterance_id": "ishigaki-r8-dai4-teireikai.gq.ishigaki-r8-dai4-ippan-shiuezato-atsushi.u0010",
      "decision": "approve_as_written",
      "final_summary": "石垣・基隆定期航路について、就航費用には港費、船員費、燃料・保険料、代理店・警備等の委託費用などを含めて算出する必要があると説明している。初就航直後で実績ベースの採算額は確定しておらず、旅客に加え貨物の積載が安定運航に不可欠だとしている。",
      "revision_reason": null,
      "attribution_confidence": "high",
      "item_match_confidence": "high",
      "speaker_name": "企画部長 菅沼副",
      "speaker_role": "executive",
      "evidence_excerpt": "就航に係る費用については、港費、船員費、潤滑油費、船舶保険料、船舶代理店や警備等の委託費用などをすべて計上し、航行にかかる費用として算出する必要があります。",
      "confirmed_facts_overlap": "none",
      "final_approval_status": "not_approved",
      "review_notes": "summary_verdict=approve_as_written。cost components、初就航直後で実績ベースの採算額が未確定であること、旅客と貨物の必要性をsourceで確認できる。"
    },
    {
      "decision_id": "r8-dai4-teireikai::ishigaki-r8-dai4-ippan-nakamine-tadashi.item01::ishigaki-r8-dai4-teireikai.gq.ishigaki-r8-dai4-ippan-nakamine-tadashi.u0006::unknown_answer_like::answer-summary-decision-v1",
      "candidate_id": "ishigaki-r8-dai4-ippan-nakamine-tadashi.item01::ishigaki-r8-dai4-teireikai.gq.ishigaki-r8-dai4-ippan-nakamine-tadashi.u0006::unknown_answer_like",
      "question_id": "ishigaki-r8-dai4-ippan-nakamine-tadashi",
      "item_number": 1,
      "source_utterance_id": "ishigaki-r8-dai4-teireikai.gq.ishigaki-r8-dai4-ippan-nakamine-tadashi.u0006",
      "decision": "hold_attribution",
      "final_summary": null,
      "revision_reason": null,
      "attribution_confidence": "medium",
      "item_match_confidence": "high",
      "speaker_name": "会計監査吉村吉",
      "speaker_role": "unknown",
      "evidence_excerpt": "各資金の詳細についてお答えいたします。本市の基金につきましては、各条例の定めに基づいて特定の目的のために基金が設置されております。",
      "confirmed_facts_overlap": "none",
      "final_approval_status": "not_approved",
      "review_notes": "item 1への答弁性は高いが、speaker表記が文字起こし上崩れており、正確な役職・氏名を確定できないためsummary化を保留する。"
    },
    {
      "decision_id": "r8-dai4-teireikai::ishigaki-r8-dai4-ippan-nakamine-tadashi.item02::ishigaki-r8-dai4-teireikai.gq.ishigaki-r8-dai4-ippan-nakamine-tadashi.u0007::unknown_answer_like::answer-summary-decision-v1",
      "candidate_id": "ishigaki-r8-dai4-ippan-nakamine-tadashi.item02::ishigaki-r8-dai4-teireikai.gq.ishigaki-r8-dai4-ippan-nakamine-tadashi.u0007::unknown_answer_like",
      "question_id": "ishigaki-r8-dai4-ippan-nakamine-tadashi",
      "item_number": 2,
      "source_utterance_id": "ishigaki-r8-dai4-teireikai.gq.ishigaki-r8-dai4-ippan-nakamine-tadashi.u0007",
      "decision": "hold_attribution",
      "final_summary": null,
      "revision_reason": null,
      "attribution_confidence": "medium",
      "item_match_confidence": "high",
      "speaker_name": "会計監査吉村吉",
      "speaker_role": "unknown",
      "evidence_excerpt": "物価高騰対策の観光事業者支援についてお答えします。観光事業者の範囲としては宿泊事業者、バス、タクシー、レンタカーなど多岐に及ぶものと承知しています。",
      "confirmed_facts_overlap": "none",
      "final_approval_status": "not_approved",
      "review_notes": "reviewed_speaker_name は候補artifact上で補助的に記録されているが、source_speaker_nameとの不一致が残るため、public向けsummary化は保留する。"
    },
    {
      "decision_id": "r8-dai4-teireikai::ishigaki-r8-dai4-ippan-taira-hideyuki.item05::ishigaki-r8-dai4-teireikai.gq.ishigaki-r8-dai4-ippan-taira-hideyuki.u0012::null_item_proximity::answer-summary-decision-v1",
      "candidate_id": "ishigaki-r8-dai4-ippan-taira-hideyuki.item05::ishigaki-r8-dai4-teireikai.gq.ishigaki-r8-dai4-ippan-taira-hideyuki.u0012::null_item_proximity",
      "question_id": "ishigaki-r8-dai4-ippan-taira-hideyuki",
      "item_number": 5,
      "source_utterance_id": "ishigaki-r8-dai4-teireikai.gq.ishigaki-r8-dai4-ippan-taira-hideyuki.u0012",
      "decision": "approve_as_written",
      "final_summary": "教育支援センター「あやぱに学級」について、開設の背景、現在の支援内容、4名体制での学習・体験活動支援、旧八重山幼稚園2階を活用しながら必要に応じて修繕している状況が説明されている。施設環境については、他の教育施設の活用も含め今後の検討事項だとしている。",
      "revision_reason": null,
      "attribution_confidence": "high",
      "item_match_confidence": "high",
      "speaker_name": "教育部長小永淳",
      "speaker_role": "executive",
      "evidence_excerpt": "アイパニ学級は平成6年4月に開設され、今年で32年目となります。あやぱに学級では登校が難しい児童生徒に対して支援を行っております。",
      "confirmed_facts_overlap": "none",
      "final_approval_status": "not_approved",
      "review_notes": "summary_verdict=approve_as_written。開設背景、支援内容、4名体制、現施設の修繕運用、施設環境の今後検討がsourceで確認できる。"
    },
    {
      "decision_id": "r8-dai4-teireikai::ishigaki-r8-dai4-ippan-taira-hideyuki.item05::ishigaki-r8-dai4-teireikai.gq.ishigaki-r8-dai4-ippan-taira-hideyuki.u0055::null_item_proximity::answer-summary-decision-v1",
      "candidate_id": "ishigaki-r8-dai4-ippan-taira-hideyuki.item05::ishigaki-r8-dai4-teireikai.gq.ishigaki-r8-dai4-ippan-taira-hideyuki.u0055::null_item_proximity",
      "question_id": "ishigaki-r8-dai4-ippan-taira-hideyuki",
      "item_number": 5,
      "source_utterance_id": "ishigaki-r8-dai4-teireikai.gq.ishigaki-r8-dai4-ippan-taira-hideyuki.u0055",
      "decision": "approve_with_revision",
      "final_summary": "あやぱに学級と青少年センターは、対象者や支援内容に違いがある一方、どちらも不登校児童生徒の学校外の居場所としての役割を持つと説明している。あやぱに学級の施設は修繕しながら運用しており、移転を含む具体的な検討時期は現時点で示せないとしている。",
      "revision_reason": "sourceの青少年センター所管課名にASRノイズがあるため、所管課名を含めず対象者・支援内容・施設検討に範囲を絞った。",
      "attribution_confidence": "high",
      "item_match_confidence": "high",
      "speaker_name": "学校教育課長 石垣 英一",
      "speaker_role": "executive",
      "evidence_excerpt": "アヤパニ学級は教育委員会の学校教育課が、青少年センターは教育委員会の生き生き花火課が所管しております。対象者につきましては、アヤパニ学級が石垣市内の小中学校に通う児童生徒です。",
      "confirmed_facts_overlap": "none",
      "final_approval_status": "not_approved",
      "review_notes": "summary_verdict=approve_with_revision。ASRノイズのある所管課名をpublic候補summaryへ持ち込まず、source-supportedな対象者・支援内容・施設検討に限定した。"
    },
    {
      "decision_id": "r8-dai4-teireikai::ishigaki-r8-dai4-ippan-inoue-michiko.item02::ishigaki-r8-dai4-teireikai.gq.ishigaki-r8-dai4-ippan-inoue-michiko.u0016::unknown_answer_like::answer-summary-decision-v1",
      "candidate_id": "ishigaki-r8-dai4-ippan-inoue-michiko.item02::ishigaki-r8-dai4-teireikai.gq.ishigaki-r8-dai4-ippan-inoue-michiko.u0016::unknown_answer_like",
      "question_id": "ishigaki-r8-dai4-ippan-inoue-michiko",
      "item_number": 2,
      "source_utterance_id": "ishigaki-r8-dai4-teireikai.gq.ishigaki-r8-dai4-ippan-inoue-michiko.u0016",